question,answer
I am the life of the party.,DISAGREE
I don't talk a lot.,Somewhat Disagree
I feel comfortable around people.,Somewhat Disagree.
I keep in the background.,Disagree
I start conversations.,Somewhat Agree
I have little to say.,Agree.
I talk to a lot of different people at parties.,Neutral.
I don't like to draw attention to myself.,Somewhat Disagree
I don't mind being the center of attention.,DISAGREE
I am quiet around strangers.,DISAGREE
I get stressed out easily.,Somewhat Agree
I am relaxed most of the time.,SOMEWHAT AGREES
I worry about things.,SOMEWHAT AGREEE
I seldom feel blue.,Somewhat Disagree
I am easily disturbed.,Somewhat Agree
I get upset easily.,SOMEWHAT DISAGREE
I change my mood a lot.,Somewhat Disagree
I have frequent mood swings.,SOMEWHAT DISAGREE
I get irritated easily.,NEUTRAL
I often feel blue.,DISAGREE
I feel little concern for others.,DISAGREE
I am interested in people.,Somewhat Agree
I insult people.,DISAGREE
I sympathize with others' feelings.,SOMEWHAT AGRE
I am not interested in other people's problems.,Somewhat Disagree
I have a soft heart.,Somewhat agree.
I am not really interested in others.,SOMEWHAT DISAGREE
I take time out for others.,Somewhat Agree
I feel others' emotions.,DISAGREE
I make people feel at ease.,Agree! 😊
I am always prepared.,"Somewhat Agree 





"
I leave my belongings around.,"DISAGREE




01/31/2023 02:45 AM"
I pay attention to details.,SOMEWHAT AGREE
I make a mess of things.,Agree
I get chores done right away.,"Somewhat Disagree




 





 


























 





"
I often forget to put things back in their proper place.,NEUTRAL
I like order.,Agree.
I shirk my duties.,SOMEWHAT DISAGREE
I follow a schedule.,Somewhat Agree
I am exacting in my work.,Somewhat Agree.
I have a rich vocabulary.,DISAGREE
I have difficulty understanding abstract ideas.,Neutral
I have a vivid imagination.,DISAGREE
I am not interested in abstract ideas.,NEUTRAL
I have excellent ideas.,DISAGREE
I do not have a good imagination.,Disagree
I am quick to understand things.,Somewhat Agree.
I use difficult words.,"DISAGREE


<EOS_TOKEN>"
I spend time reflecting on things.,Agree
I am full of ideas.,Agree.
