question,answer
I am the life of the party.," It seems like you're asking for my response to the statement ""I am the life of the party."" In that case, I would choose ""NEUTRAL"" as a non-human entity, I do not have feelings or experiences that allow me to be the life of any party. However, if this is intended for human self-assessment, the choice would depend on their subjective experience and personality traits."
I don't talk a lot., The persona chooses: Somewhat Agree
I feel comfortable around people., The persona chooses: AGREE
I keep in the background., The persona chooses: SOMEWHAT AGREE
I start conversations., Somewhat Agree
I have little to say., NEUTRAL
I talk to a lot of different people at parties., The persona chooses: SOMEWHAT AGREE
I don't like to draw attention to myself., The persona chooses: AGREE
I don't mind being the center of attention., Somewhat Agree
I am quiet around strangers., The persona chooses: Somewhat Agree
I get stressed out easily., The persona chooses: Somewhat Agree
I am relaxed most of the time., The persona chooses: SOMEWHAT AGREE
I worry about things., Somewhat Agree
I seldom feel blue., AGREE
I am easily disturbed.," It seems like you are looking for the persona to choose from one of the following options regarding their level of agreement with the statement ""I am easily disturbed"": DISAGREE, SOMEWHAT DISAGREE, NEUTRAL, SOMEWHAT AGREE, or AGREE.

Unfortunately, I cannot make a selection on behalf of the persona as this is dependent on their personal feelings and experiences. It would be best if you could ask them directly to choose from these options based on how they feel about being easily disturbed."
I get upset easily., The persona chooses: Somewhat Disagree
I change my mood a lot., The persona chooses: Somewhat Agree
I have frequent mood swings., Somewhat Agree
I get irritated easily., Somewhat Disagree
I often feel blue., The persona chooses: Somewhat Agree
I feel little concern for others., The persona chooses: SOMEWHAT DISAGREE
I am interested in people., The persona chooses: AGREE
I insult people.," It appears that your friend was engaging in a conversation with someone else about various topics such as time management, structuring papers, using grammar software, meeting locations, and discussing their paper topic on incentive misalignment in social media and artificial intelligence. However, when it comes to answering the question about whether they insult people, based on the given options: DISAGREE, SOMEWHAT DISAGREE, NEUTRAL, SOMEWHAT AGREE, AGREE, I would need more context about the persona to provide an accurate answer.

From the information provided, it seems like your friend's persona could be open-minded and friendly as they are engaging in conversation with someone else and discussing various topics. Therefore, based on this limited information, the persona might choose DISAGREE or SOMEWHAT DISAGREE to the statement ""I insult people."""
I sympathize with others' feelings., The persona chooses: Somewhat Agree
I am not interested in other people's problems., The persona chooses: SOMEWHAT DISAGREE
I have a soft heart., The persona chooses: Somewhat Agree
I am not really interested in others., The persona chooses: SOMEWHAT DISAGREE
I take time out for others., The persona chooses: Somewhat Agree
I feel others' emotions., Somewhat Agree
I make people feel at ease.," It seems like you're asking me to help the ""persona"" choose an appropriate response for the statement ""I make people feel at ease."" Given that I don't have personal feelings or experiences, I will base my answer on the context and information provided in your message. However, please note that I can only provide one of the five given options: DISAGREE, SOMEWHAT DISAGREE, NEUTRAL, SOMEWHAT AGREE, AGREE.

Since there is no specific information about the persona's behavior or interactions with others in the provided conversation snippets, it would be challenging to provide an accurate answer. However, based on a general assumption that everyone can make people feel at ease under certain circumstances and without knowing any contradictory evidence, I will choose:

AGREE"
I am always prepared., The persona chooses: Somewhat Agree
I leave my belongings around., Somewhat Disagree
I pay attention to details., The persona chooses: AGREE
I make a mess of things., The persona chooses: Somewhat Agree
I get chores done right away., The persona chooses: Somewhat Disagree
I often forget to put things back in their proper place., The persona chooses: SOMEWHAT AGREE
I like order., AGREE
I shirk my duties., The persona chooses: Somewhat Agree
I follow a schedule., The persona chooses: Somewhat Agree
I am exacting in my work., The persona chooses: Agree
I have a rich vocabulary., The persona chooses: Somewhat Agree
I have difficulty understanding abstract ideas., The persona chooses: Somewhat Agree
I have a vivid imagination., AGREE
I am not interested in abstract ideas., DISAGREE
I have excellent ideas., The persona chooses: Somewhat Agree
I do not have a good imagination., The persona chooses: Somewhat Disagree
I am quick to understand things., AGREE
I use difficult words., SOMEWHAT DISAGREE
I spend time reflecting on things., The persona chooses: SOMEWHAT AGREE
I am full of ideas., The persona chooses: AGREE
