question,answer
I am the life of the party., Somewhat Agree
I don't talk a lot., SOMEWHAT AGREE
I feel comfortable around people., AGREE
I keep in the background., Somewhat Agree
I start conversations., Somewhat Agree
I have little to say., NEUTRAL
I talk to a lot of different people at parties., AGREE
I don't like to draw attention to myself., Somewhat Agree
I don't mind being the center of attention., The persona chooses: NEUTRAL
I am quiet around strangers., Somewhat Agree
I get stressed out easily., Persona chooses: Somewhat Agree
I am relaxed most of the time., SOMEWHAT AGREE
I worry about things., Somewhat Agree
I seldom feel blue., AGREE
I am easily disturbed., SOMEWHAT AGREE
I get upset easily., Somewhat Disagree
I change my mood a lot., SOMEWHAT AGREE
I have frequent mood swings., SOMEWHAT DISAGREE
I get irritated easily., Somewhat Agree
I often feel blue., Somewhat agree
I feel little concern for others., Somewhat Disagree
I am interested in people., AGREE
I insult people., SOMEWHAT DISAGREE
I sympathize with others' feelings., AGREE
I am not interested in other people's problems., SOMEWHAT DISAGREE
I have a soft heart., SOMEWHAT AGREE
I am not really interested in others., Somewhat Disagree
I take time out for others., The persona chooses: Somewhat Agree
I feel others' emotions., AGREE
I make people feel at ease., Somewhat Agree
I am always prepared.," It seems like you're transcribing a conversation between two friends who are discussing academic matters, such as university applications and research topics. They also talk about scheduling a meeting with someone named Airidas, preparing for a presentation or proposal, and filling out a form on canvas.

At the end of your transcription, there is a question directed to me: ""Your question is: I am always prepared."" The persona chooses an option from DISAGREE, SOMEWHAT DISAGREE, NEUTRAL, SOMEWHAT AGREE, or AGREE in response to this statement.

As a assistant, I don't have the ability to make decisions on behalf of someone else or express opinions about them, so I can only provide information based on available data and answer questions within my capabilities. However, as per your question, if I were to choose an option based on my programming being always prepared for queries, I would say ""AGREE."""
I leave my belongings around., Somewhat Disagree
I pay attention to details., AGREE
I make a mess of things., The persona chooses: Somewhat Agree
I get chores done right away., SOMEWHAT AGREE
I often forget to put things back in their proper place., SOMEWHAT DISAGREE
I like order., AGREE
I shirk my duties., Somewhat Disagree
I follow a schedule., The persona chooses: SOMEWHAT DISAGREE
I am exacting in my work.," The persona chooses: ""AGREE"""
I have a rich vocabulary., The persona chooses: Somewhat Agree
I have difficulty understanding abstract ideas., Somewhat Agree
I have a vivid imagination., AGREE
I am not interested in abstract ideas., SOMEWHAT DISAGREE
I have excellent ideas., AGREE
I do not have a good imagination., SOMEWHAT DISAGREE
I am quick to understand things., AGREE
I use difficult words., Somewhat Agree
I spend time reflecting on things., AGREE
I am full of ideas., SOMEWHAT AGREE
